study_id,title,first_author,venue,year,iot_domain,topology,agent_architecture,reasoning_strategy,cybersecurity_focus,benchmarks,critical_limitations,compound_failure_mode,reports_false_discovery_rate,coding_source
ref-139,Intelligent Detection of IoT Botnets Using Machine Learning and Deep Learning,Kim,MDPI,2020,general IoT,,non-agentic-baseline,none,detection,,,,,author-verified
ref-140,LLMs in Cyber Security: Bridging Practice and Education,Atlam,MDPI,2025,cross-cutting,,single-agent,,,,,,,author-verified
ref-141,Exploring the Potential of Anomaly Detection Through Reasoning with Large Language Models,Park,MDPI,2025,cross-cutting,,single-agent,cot,threat-intelligence,,,,,manuscript-explicit
ref-142,LogRESP-Agent: A Recursive AI Framework for Context-Aware Log Anomaly Detection and TTP Analysis,Lee,MDPI,2025,cross-cutting,,multi-agent,,threat-hunting,,,tool-use-amplification,,manuscript-explicit
ref-143,Leveraging LLMs for Scalable and Explainable Cybersecurity Log Analysis,Palma,MDPI,2025,cross-cutting,,single-agent,,,,,,,author-verified
ref-144,"Next-Generation Spam Filtering: Comparative Fine-Tuning of LLMs, NLPs, and CNN Models for Email Spam Classification",Roumeliotis,MDPI,2024,cross-cutting,,single-agent,,threat-intelligence,,,,,author-verified
ref-145,Enhancing Adversarial Robustness in NIDS: A Novel Adversarially Trained Neural Network Approach,Heydari,MDPI,2025,cross-cutting,,non-agentic-baseline,none,,,,,,author-verified
ref-146,"Securing the Cognitive Layer: A Survey on Security Threats, Defenses, and Privacy-Preserving Architectures for LLM-IoT Integration",Joshi,MDPI,2026,general IoT,,single-agent,,cross-cutting (survey),,,,,author-verified
ref-147,LLM-Powered Proactive Cyber-Defense Framework Using Cyber-Threat Indicators Collected from X Platform,Almutairi,MDPI,2026,cross-cutting,,single-agent,,threat-hunting,,,,,manuscript-explicit
ref-148,Labeling NIDS Rules with MITRE ATT&CK Techniques: Machine Learning vs,Daniel,MDPI,2025,cross-cutting,,non-agentic-baseline,none,threat-intelligence,,,,,author-verified
ref-149,Next-Gen Explainable AI (XAI) for Federated and Distributed IoT Systems: A State-of-the-Art Survey,Karras,MDPI,2026,general IoT,fog,non-agentic-baseline,none,cross-cutting (survey),,,,,author-verified
ref-150,GNN-Based Network Traffic Analysis for the Detection of Sequential Attacks in IoT,Altaf,MDPI,2024,general IoT,,non-agentic-baseline,none,detection,,,,,author-verified
ref-151,Optimizing IoT Intrusion Detection - A GNN Approach with Attribute-Based Graph Construction,Ngo,MDPI,2025,general IoT,,non-agentic-baseline,none,detection,,,,,author-verified
ref-152,Efficient DL-Based Cyber-Attack Detection for IoMT Devices,Judith,MDPI,2023,medical IoT,,single-agent,,detection,,,,,manuscript-explicit
ref-153,A Lightweight Intrusion Detection System for IoT and UAV Using Deep Neural Networks with Knowledge Distillation,Wisanwanichthan,MDPI,2025,vehicular IoT,edge,single-agent,,detection,,,,,manuscript-explicit
